FM;KD_JENIS_TRANSAKSI;FG_PENGGANTI;NOMOR_FAKTUR;MASA_PAJAK;TAHUN_PAJAK;TANGGAL_FAKTUR;NPWP;NAMA;ALAMAT_LENGKAP;JUMLAH_DPP;JUMLAH_PPN;JUMLAH_PPNBM;IS_CREDITABLE;BRANCH;PAJAK_LINE_ID;AKUN_BEBAN;INVOICE_NUMBER;MATA_UANG
FM;03;0;0032170029556;06;2021;20/05/2021;024387839016000;"PT. ELANG CAKRA SECURINDO";"Jl. Adhyaksa Raya No. 21";14798160;1479816;0;1;110;4335622;;2021/06/28/4;IDR
FM;03;0;0032190690379;06;2021;18/05/2021;909657926042000;"KOPERASI PANDU BAHTERA SEJAHTERA";"Jl. Tenggiri 103 Tanjung Priok";28421483;2842148;0;1;110;4335621;;2021/06/23/1;IDR
FM;03;0;0042131885446;06;2021;09/06/2021;012389821304000;"KOKARPEL (PANGKALBALAM)";"JL. YOS SUDARSO NO. 1";19793975;1979397;0;1;110;4335620;;2021/06/15/1;IDR
FM;03;0;0032170029512;06;2021;17/05/2021;024387839016000;"PT ELANG CAKRA SECURINDO";"JL. LEBAK BULUS RAYA NO. 07A, RT. 003, RW. 002, LEBAK BULUS, CILANDAK";117084345;11708435;0;1;110;4335619;;2021/06/14/4;IDR
FM;03;0;0042131885444;06;2021;25/05/2021;012389821304000;"KOKARPEL (PANGKALBALAM)";"JL. YOS SUDARSO NO. 1";1481300;148130;0;1;110;4335618;;2021/06/14/2;IDR
FM;03;0;0042148786995;06;2021;21/06/2021;011187127423000;"PT RAYA SURVERINDO TIRTASARANA";"JL. TUBAGUS ISMAIL VIII NO. 27 DAGO KOTA BANDUNG";83092961;8309296;0;1;110;4335624;;006/B02.SPVS/BELINYU/RS-BDG/VI/2021;IDR
FM;03;0;0042148786994;06;2021;21/06/2021;011187127423000;"PT RAYA SURVERINDO TIRTASARANA";"JL. TUBAGUS ISMAIL VIII NO. 27 DAGO KOTA BANDUNG";83092961;8309296;0;1;110;4335623;;005/B02.SPVS/BELINYU/RS-BDG/VI/2021;IDR
FM;03;0;0042148786991;06;2021;21/04/2021;011187127423000;"PT RAYA SURVERINDO TIRTASARANA";"JL. TUBAGUS ISMAIL VIII NO. 27 DAGO KOTA BANDUNG";83092961;8309296;0;1;110;4335625;;004/B02.SPVS/BELINYU/RS-BDG/IV/2021;IDR
